Clt_No,Po_No,Accumulate,Insuredname,Risklocation,DIV,CTR,CLS,STT,Effectivedate,Inceptiondate,Renewdate,Contracttype,Rkn,Risktype,OriginalSI,VNDSI,Survey date1,Survey date 2,Survey date 3,Survey date 4,Survey date 5,Survey date 6,Survey date 7,Survey date 8,Survey date 9,Fire code,Agentname,Occupation,BusinessLine,Remark
10000848,20003137,BDDASTBEST,"BEST SOUTH ENTERPRISE CO., LTD","BEST SOUTH ENTERPRISE CO., LTD, 11 Road 2, Song Than 1 IZ, Di An, Binh Duong",MS,TWN,E,IF,02/04/2021,01/04/2021,31/03/2022,FEC - FIRE AND EXPL COMP,1,FEC - COMPULSORY FIRE and EXPLOSION,99904852728,99904852728,20190218,,20190218,,20170221,,20150309,,20130315,18.1AB,DIRECT-TAIWAN SOUTH ,Adhesives for shoes industrial,  ,
10000107,20041500,HDCGCPBROT,BROTHER INDUSTRIES (VIETNAM) LTD,"Brother Industries (Vietnam) Ltd., Phuc Dien IZ, Cam Phuc Commune, Cam Giang, Hai Duong",VH,JPN,C,IF,01/04/2021,01/04/2021,31/03/2022,ISR - INDUSTRIAL ALL RISKS,1,ARB - PROPERTY ALL RISKS,178558109,4140000000000,20171113,,,,20171113,,,,,18.1AB,MARSH-BRK-VH,As above,"Manufacturing fax, printer, multi-function machines & other related activities ",
10001089,20004437,DNCLHC10C2,DAIKIN AIR CONDITIONING (VIETNAM) JOINT STOCK COMPANY,"DAIKIN AIR CONDITIONING VN- Logitem Transimex WH, Lot C2-9, Road 10, Hoa Cam IP, Cam Le, Da Nang",VC,JPN,D,IF,05/05/2021,01/04/2021,31/03/2022,ARC - PROPERTY ALL RISKS,9,ARB - PROPERTY ALL RISKS,1.26E+11,126000000000,20181108,,,20181108,,,,,,18.1AB,AON-BRK-VC,Warehouse,Principally trading and servicing to Daikin Air-cons and other related activities and other incidental activities thereto,
10000110,20003315,HNDATLIE1,"DENSO MANUFACTURING VIETNAM CO., LTD","DENSO Manufacturing Vietnam Co., Ltd, Plot E1, Thang Long IP, Dong Anh, Ha Noi",VH,JPN,C,IF,02/04/2021,01/04/2021,31/03/2022,ISR - INDUSTRIAL ALL RISKS,1,ARB - PROPERTY ALL RISKS,76325792,1760000000000,20180607,,,20180607,,,20150311,,,18.2A,TOYOTA TSUSHO-BRK-VH,Automobile Parts Manufacturer,Automobile Parts Manufacturer  ,
10000069,20032717,BDDAST26FY,"FUJIFILM BUSINESS INNOVATION VIETNAM CO., LTD.","Nippon Express Vietnam- Song Than Logistic Center, Lot F,Road No.6 Song Than 2 IZ, Di An, Binh Duong",VC,JPN,D,IF,02/04/2021,01/04/2021,31/03/2022,ISR - INDUSTRIAL ALL RISKS,9,ARB - PROPERTY ALL RISKS,20515689185,20515689185,20190517,,20190517,,,,,,,17.1B,WILLIS TOWERS WATSON-BRK-VC,Warehouse,"Document hardware and software, and related documentation services ",
10002604,20025837,HPHAMOLFUX,"FUJIFILM MANUFACTURING HAI PHONG CO.,LTD.","MOL Warehouse, Dinh Vu service area, Dong Hai 2, Hai An Dist, Hai Phong",VH,JPN,D,IF,14/06/2021,01/04/2021,31/03/2022,ISR - INDUSTRIAL ALL RISKS,1,ARB - PROPERTY ALL RISKS,4.49E+11,449000000000,,,,,,,,,,17.1B,WILLIS TOWERS WATSON-BRK-VH,Warehouse,Printer / Copy manufacturing  ,
10001628,20006667,HYYMTLHAMA,"HAMADEN VIETNAM CO., LTD","Hamaden Vietnam Factory, Plot A4, Thang Long 2 IP, Yen My, Hung Yen",VH,JPN,C,IF,01/04/2021,01/04/2021,31/03/2022,ISR - INDUSTRIAL ALL RISKS,1,ARB - PROPERTY ALL RISKS,45735062,1050000000000,20190919,,20190919,,,,20150312,,,18.2A,TOYOTA TSUSHO-BRK-VH,Automobile Parts Manufacturer,  ,
10006596,20032186,HNLBTDCT1,"HASEKO HIMLAMBC CO., LTD","TU DINH RESIDENCE COMPLEX, Long Bien, Ha Noi",VH,JPN,A,IF,01/04/2021,01/04/2021,31/03/2022,ISR - INDUSTRIAL ALL RISKS,1,ARB - PROPERTY ALL RISKS,2.85E+11,285000000000,,,,,,,,,,9.1A,DIRECT HANOI,"Tenement house, apartment block",  ,
10000074,20003115,SGBT248NTL,SONY ELECTRONICS VIETNAM COMPANY LIMITED,"SONY ELECTRONICS VIETNAM-SONY VIETNAM, 248A No Trang Long Str, Binh Thanh, HCMC",VC,JPN,C,IF,01/04/2021,01/04/2021,31/03/2022,ISR - INDUSTRIAL ALL RISKS,2,LOP - LOSS OF PROFIT,8.49E+11,849000000000,20110223,,,,,,,,,10A,DIRECT HCM,As mentioned above,Sales Marketing Branding Research & Development Design Testing and Distribution of Audio/ Video/ Cameras/ Video decks/ Televisions/ PC/ Semiconductors,
10000163,20001887,DNBHLBTOSH,"TOSHIBA INDUSTRIAL PRODUCTS ASIA CO.,LTD","TOSHIBA INDUSTRIAL PRODUCTS ASIA CO.,LTD, No,309, Road 9, Amata IP,Long Binh, Bien Hoa, Dong Nai",VC,JPN,C,IF,01/04/2021,01/04/2021,31/03/2022,ISR - INDUSTRIAL ALL RISKS,1,ARB - PROPERTY ALL RISKS,55476382,1280000000000,20180116,,,20180116,,,,,20130510,18.1AB,DIRECT HCM,Electric Motor Devices,  ,
10002928,20011134,DNCLHCTOKA,"VIETNAM TOKAI CO., LTD","VIETNAM TOKAI CO., LTD, Road No.1, Hoa Cam IZ, Cam Le District, Da Nang",VC,JPN,E,IF,03/04/2021,03/04/2021,02/04/2022,ISR - INDUSTRIAL ALL RISKS,1,ARB - PROPERTY ALL RISKS,8976428,207000000000,20191226,,20191226,,20170313,,,20140926,,18.1AB,TOYOTA TSUSHO-BRK-VC,As described above,Manufacture and Sales of automobile parts made of plastic  ,
10000109,20003162,HNDATLIB11,"OHARA PLASTICS VIETNAM CO., LTD.","OHARA PLASTICS VIETNAM CO., LTD., B11/B12, Thang Long IP, Dong Anh, Ha Noi",VH,JPN,E,IF,10/04/2021,10/04/2021,09/04/2022,ISR - INDUSTRIAL ALL RISKS,1,ARB - PROPERTY ALL RISKS,5746531,133000000000,20190322,,20190322,,,20160428,,,20130627,18.1AB,DIRECT HANOI,Molder of Engineering plastics production,  ,
10000716,20015579,SGTDLXSUWH,"JOINT VENTURE SUNRISE LOGISTICS CO., LTD","JV SUNRISE LOGISTICS CO., LTD-Warehouse, Highway 1A, 27B Truong Son,Linh Xuan Ward, Thu Duc, HCMC",VC,JPN,E,IF,12/04/2021,12/04/2021,11/04/2022,ISR - INDUSTRIAL ALL RISKS,1,ARB - PROPERTY ALL RISKS,27761000000,27761000000,,,,,,,,,,17.1B,DIRECT HCM,Freight forwarder/Logistics/NVOCC/Warehousing,  ,"Low SI, as per new guideline"
10017636,20041528,HNMLQMKASH,"KASHIYAMA VIETNAM CO., LTD","KASHIYAMA VIETNAM CO., LTD, Lot 44D, Quang Minh IZ, Chi Dong Town, Me Linh, Ha Noi",VH,JPN,E,IF,13/04/2021,13/04/2021,12/04/2022,ISR - INDUSTRIAL ALL RISKS,1,ARB - PROPERTY ALL RISKS,34402674143,34402674143,,,,,,,,,,18.2A,DIRECT HANOI,Equipment Maintenance Company,Equipment Maintenance Company  ,
10000910,20022815,VPBXMARUSS,MARUICHI SUN STEEL (HANOI) COMPANY LIMITED,"MARUICHI SUN STEEL JOINT STOCK COMPANY, Binh Xuyen IZ, Binh Xuyen District, Vinh Phuc",VC,JPN,B,IF,17/04/2021,14/04/2021,13/04/2022,ISR - INDUSTRIAL ALL RISKS,1,ARB - PROPERTY ALL RISKS,4.62E+11,462000000000,20170504,,,,20170504,,,,,18.2A,TOYOTA TSUSHO-BRK-VC,Manufacturing of Steel pipe,  ,
10002959,20020103,DNHVHTR5TK,"TOKYO KEIKI PRECISION TECHNOLOGY CO., LTD","TOKYO KEIKI PRECISION TECHNOLOGY CO., LTD, Lot A15,Central Road No.5,Hi-techpark,Hoa Vang, Da Nang",VC,JPN,C,IF,15/04/2021,15/04/2021,14/04/2022,ISR - INDUSTRIAL ALL RISKS,1,ARB - PROPERTY ALL RISKS,2.49E+11,249000000000,20191227,,20191227,,,20160302,,,,18.2A,DIRECT HCM,Production of Hydraulic Equipment,  ,
10013349,20091269,DNBHICD01A,"WWRC VIETNAM CO., LTD.","ICD TAN CANG - LONG BINH WAREHOUSE - No. 01A, G243 Bui Van Hoa Street, Long Binh, Bien Hoa, Dong Nai",VC,SGP,E,IF,16/04/2021,15/04/2021,14/04/2022,ISR - INDUSTRIAL ALL RISKS,1,ARB - PROPERTY ALL RISKS,30000000000,30000000000,,,,,,,,,,17.1B,DIRECT HCM,Trading,Trading  ,"Low SI, as per new guideline"
10000876,20008152,SGBTTTLIEN,"LIEN HSING CO., LTD","LIEN HSING CO., LTD, Lot 17, Road 2, Tan Tao IZ, Binh Tan, HCMC",MS,TWN,D,IF,13/07/2021,19/04/2021,18/04/2022,FII - FIRE AND NAMED PERILS,1,FII - FIRE INDUSTRIAL,38078096624,38078096624,20180209,,,20180209,,,20150310,,,18.1AB,DIRECT-TAIWAN SOUTH ,Embroidering,Embroidering  ,
10032743,20068112,VPBXBT2MFV,"MITSUBOSHI FORMING VIETNAM CO., LTD","MITSUBOSHI FORMING VIETNAM CO., LTD, Plot No C3-1, Ba Thien 2 IZ, Thien Ke, Binh Xuyen, Vinh Phuc",VH,VNM,C,IF,19/04/2021,19/04/2021,18/04/2022,ISR - INDUSTRIAL ALL RISKS,1,ARB - PROPERTY ALL RISKS,84223288800,84223288800,,,,,,,,,,18.2A,DIRECT HANOI,Cold deformation process for pipe and shaft,  ,
10009814,20026365,HNDTDV2CSP,"CS PLASTICS VIETNAM CO., LTD","CS Plastic Vietnam, Dong Van 2 IP, Duy Tien, Ha Nam",VH,JPN,E,IF,23/04/2021,22/04/2021,21/04/2022,ISR - INDUSTRIAL ALL RISKS,1,ARB - PROPERTY ALL RISKS,30450704658,30450704658,20190319,,20190319,,20170321,,,,,18.1AB,DIRECT HANOI,Manufacturing plastic parts,  ,
10000154,20000359,HPADNOMURA,FUJIKURA COMPOSITES HAIPHONG INC.,"FURIKURA COMPOSITES HAIPHONG INC, Plot D3-6, Nomura IZ, An Duong, Hai Phong",VH,JPN,E,IF,27/04/2021,23/04/2021,22/04/2022,ISR - INDUSTRIAL ALL RISKS,1,ARB - PROPERTY ALL RISKS,32639094,753000000000,20190321,,20190321,,,20160427,,,20130719,18.1AB,DIRECT HANOI,As described above,"Producing life raft, sporting goods, electric material, industrial goods ",
10012526,20050422,BDTDM1CN16,CONG TY TNHH ALWIN VIET NAM,"CONG TY TNHH ALWIN VIETNAM, Lot CN 16, lot 1C, Str 4, Song Than 3, Thu Dau Mot, Binh Duong",VC,USA,D,IF,25/04/2021,25/04/2021,24/04/2022,ISR - INDUSTRIAL ALL RISKS,1,ARB - PROPERTY ALL RISKS,45330305188,45330305188,,,,,,,,,,18.1AB,DIRECT HCM,San xuat hop dung giay ve sinh cac loai,"Carton Box, Pads, Stickers, Tape, PE film for Product Packaging, Toilet Paper Rolls for product testing ",
10000081,20025794,DNBHLBMUTO,"MUTO VIETNAM CO., LTD","MUTO VIETNAM CO., LTD, Lot C-7-1, Road 2, Long Binh IP, Bien Hoa, Dong Nai",VC,JPN,C,IF,01/05/2021,29/04/2021,28/04/2022,ISR - INDUSTRIAL ALL RISKS,1,ARB - PROPERTY ALL RISKS,1E+12,1000000000000,20140521,,,,,,,20140521,,18.1AB,DIRECT HCM,Electronic Parts,  ,
10018529,20068938,DNCLHXPH09,"TOYOTA OKAYAMA DA NANG CO., LTD.","TOYOTA OKAYAMA DA NANG CO.,LTD, No.9, Pham Hung Street, Hoa Xuan Ward, Cam Le Dist, Da Nang",VC,JPN,C,IF,30/04/2021,30/04/2021,29/04/2022,ISR - INDUSTRIAL ALL RISKS,1,ARB - PROPERTY ALL RISKS,2.89E+11,289000000000,,,,,,,,,,8.2B,DIRECT HCM,KINH DOANH MUA BAN VA SUA CHUA XE,  ,
10004727,20049835,HDCGYONGHA,ITSUWA SHOJI KAISHA. INC.,"Yong Han Precision Technology Co., Ltd, Lot.B7,B8 Phuc Dien Industrial Zone, Cam Giang, Hai Duong",VH,JPN,E,IF,01/05/2021,01/05/2021,30/04/2022,ISR - INDUSTRIAL ALL RISKS,5,ARB - PROPERTY ALL RISKS,148956000,30698342040,,,,,,,,,,18.1AB,DIRECT HANOI,As above,"Manufacture and sales of electronic part, audio equipment, and mold ","Low SI, as per new guideline"
10012017,20032967,HNDTDV2KKV,"KANAYAMA KASEI VIETNAM CO., LTD","KANAYAMA KASEI VIETNAM CO., LTD, Dong Van 2 Industrial Zone, Duy Tien District,, Ha Nam",VH,JPN,E,IF,01/05/2021,01/05/2021,30/04/2022,ISR - INDUSTRIAL ALL RISKS,1,ARB - PROPERTY ALL RISKS,39826546965,39826546965,20170412,,,,20170412,,,,,18.1AB,DIRECT HANOI,As above,"Manufacture, assemble, process spare part and product in plastic ",
10001957,20023555,HYVLPNARA5,"VIETNAM MIE CO., LTD","VIETNAM MIE CO., LTD, Road A5, Pho Noi A IZ, Dinh Du, Van Lam, Hung Yen",VH,JPN,C,IF,02/05/2021,01/05/2021,30/04/2022,ISR - INDUSTRIAL ALL RISKS,3,ARB - PROPERTY ALL RISKS,17513005,404000000000,20190109,,20190109,,,,,,,18.2A,DIRECT HANOI,"Formed parts, Molding Manufacturer","Formed parts, Molding Manufacturer  ",
10001999,20008255,BNTDDDHSHA,"HAYAKAWA ELECTRONICS VIETNAM CO., LTD","HAYAKAWA ELECTRONICS VIETNAM CO., LTD, Lot A3, Dai Dong Hoan Son IP, Tien Du district, Bac Ninh",VH,JPN,C,IF,02/05/2021,02/05/2021,01/05/2022,ISR - INDUSTRIAL ALL RISKS,1,ARB - PROPERTY ALL RISKS,10178492,235000000000,20180925,,,20180925,,,20150205,,,18.1AB,DIRECT HANOI,Wiring harness,  ,
10071645,20091706,BDBBTBL1B4,"LAC GIA FURNITURE MANUFACTURING CO., LTD.","LAC GIA FURNITURE MANUFACTURING, LO 1B4, CN 15 & LO 1B5, CN8&15, Tan Binh, Hung Hoa, Binh Duong",MS,CNY,D,IF,10/05/2021,10/05/2021,09/05/2022,FEC - FIRE AND EXPL COMP,1,FEC - COMPULSORY FIRE and EXPLOSION,53949741154,53949741154,,,,,,,,,,18.1AB,DIRECT-TAIWAN SOUTH ,Furniture Manufacturing,  ,
10004998,20016038,DNLTLDHORY,"HORY VIETNAM CO., LTD","HORY VIETNAM CO., LTD, Plot J1 & J2, Long Duc IP, Long Thanh District, Dong Nai",VC,JPN,C,IF,15/05/2021,15/05/2021,14/05/2022,ARC - PROPERTY ALL RISKS,2,ARB - PROPERTY ALL RISKS,18680779,431000000000,20190125,,20190125,,,,,,,18.2A,MARSH-BRK-VC,As above,Principally manufacturing and trading of Temporary Resources - 'Scaffolding equipment' and other incidental activities thereto.,
10002029,20008377,BDBCMPIP3K,"KOYO SANGYO VIETNAM CO.,LTD","KOYO SANGYO VIETNAM CO.,LTD, Lot B 3B10 CN,My Phuoc 3 IP, Ben Cat District, Binh Duong",VC,JPN,E,IF,16/05/2021,15/05/2021,14/05/2022,ISR - INDUSTRIAL ALL RISKS,1,ARB - PROPERTY ALL RISKS,87802689476,87802689476,20190416,,20190416,,,20160201,,,20130520,18.1AB,DIRECT HCM,Glue and plastic package manufacture,  ,
10007385,20026739,SGBCVLB51,"INTERNATIONAL PRESS SOFTCOM VIETNAM CO., LTD","INTERNATIONAL PRESS SOFTCOM VIETNAM CO., LTD., B51/1, Street No. 2E, Vinh Loc IP, Binh Chanh, HCMC",VC,SGP,E,IF,17/05/2021,17/05/2021,16/05/2022,ISR - INDUSTRIAL ALL RISKS,1,ARB - PROPERTY ALL RISKS,31228854718,31228854718,20190423,,20190423,,,,,,,18.1AB,DIRECT HCM,"Paper Print & Packaging, Software Packaging",  ,
10077640,20092276,HDHDTKSHIN,"TORAY INTERNATIONAL TRADING (HONG KONG) CO., LTD.","Shints BVT Co., LTD, Thach Khoi ward, Hai Duong city, Hai Duong",VH,CNY,D,IF,17/05/2021,17/05/2021,16/05/2022,ISR - INDUSTRIAL ALL RISKS,1,ARB - PROPERTY ALL RISKS,4000000,92200000000,,,,,,,,,,18.1AB,DIRECT HANOI,Manufacturing Apparel,  ,
10042652,20069782,BNTDVSFABR,FABRI-TECH COMPONENTS (VIETNAM) COMPANY LIMITED,"FABRI-TECH Components (Vietnam) Company Limited, B1&B2, No.5, 21A Str, VSIP Bac Ninh, Tien Du Dist, Bac Ninh",VH,SGP,E,IF,23/05/2021,22/05/2021,21/05/2022,ISR - INDUSTRIAL ALL RISKS,1,ARB - PROPERTY ALL RISKS,20803335597,20803335597,,,,,,,,,,18.1AB,DIRECT HANOI,As above,Customised precision fabricator and convertor of all types of resilient materials ,
10005175,20016419,HNDTDVNIPP,"NIPPON THERMOSTAT VIETNAM CO.,LTD","NIPPON THERMOSTAT VIETNAM CO., LTD, Dong Van 2 IP, Duy Tien District, Ha Nam",VH,JPN,E,IF,30/05/2021,30/05/2021,29/05/2022,ISR - INDUSTRIAL ALL RISKS,1,ARB - PROPERTY ALL RISKS,1.13E+11,113000000000,20190402,,20190402,,,,,,,18.2A,DIRECT HANOI,Motorbikes parts manufacturing,  ,
10016233,20041507,BDQNNH2MLV,"MARUBENI LUMBER VIETNAM CO., LTD","MARUBENI LUMBER VIETNAM CO., LTD, Lot B1.01 - B1.04, Nhon Hoi IP, Park A, Quy Nhon, Binh Dinh",VC,JPN,E,IF,31/05/2021,31/05/2021,30/05/2022,ARC - PROPERTY ALL RISKS,1,ARB - PROPERTY ALL RISKS,3104000,71609280000,,,,,,,,,,18.1AB,MARSH-BRK-VC,As above,"Funiture and Kid's toy made from Japanese Cypress, wood working materials such as: Poplar LVL plywood; Paulownia Joint Panel; Japanese Cypress Timber; other kind of",
10000194,20000479,HYVLTTPNAB,"JP CORELEX (VIETNAM) CO., LTD.","JP CORELEX CO., LTD, Road B1, Sec B, Pho Noi A IP, Trung Trac, Van Lam, Hung Yen",VH,JPN,E,PE,02/06/2021,01/06/2021,31/05/2022,ISR - INDUSTRIAL ALL RISKS,1,ARB - PROPERTY ALL RISKS,52520151,1210000000000,20171206,,,,20171206,,,,,18.1AB,DIRECT HANOI,As above,"Manufacture and Distribution/ Sales of tissue products, packaging materials and all other related activities ",
10003968,20049626,DNNTNT3PNS,"SANKYU (VIETNAM) CO., LTD","SANKYU LOGISTICS (VIETNAM) CO., LTD, Lot 9B, Rd 4, Nhon Trach 3 IP, Phase 2, Nhon Trach, Dong Nai",VC,JPN,D,IF,24/03/2021,23/03/2021,31/05/2022,ISR - INDUSTRIAL ALL RISKS,1,ARB - PROPERTY ALL RISKS,2.71E+11,271000000000,,,,,,,,,,17.1B,MARSH-BRK-VC,Warehouse Logistics,"All Activities of the Insured including but not limited to Import & Export Forwarding, General Air, Sea and Land Transportation, Warehouse & Distribution Services, Export",
10043097,20070185,BNDTVSIPBN,"VOLTRONIC POWER TECHNOLOGY (VIETNAM) CO.,LTD","VOLTRONIC POWER TECHNOLOGY (VIETNAM), Lot B1A/B/C, No.5, Rd 21A, VSIP Bac Ninh, Tien Du, Bac Ninh",MN,TWN,C,IF,01/08/2021,01/06/2021,31/05/2022,ISR - INDUSTRIAL ALL RISKS,1,ARB - PROPERTY ALL RISKS,74675878807,74675878807,,,,,,,,,,18.1AB,DIRECT-TAIWAN NORTH,Assembling UPS,  ,
10024612,20051078,BDBBBBB3CY,"YUE CHANG (VN) WOVEN TAPES ENTERPRISE CO., LTD","YUE CHANG (VN) WOVEN TAPES ENTERPRISE CO., LTD, Lot B 3C-CN, Bau Bang IZ, Bau Bang,, Binh Duong",MS,TWN,D,IF,01/06/2021,01/06/2021,31/05/2022,FEC - FIRE AND EXPL COMP,1,FEC - COMPULSORY FIRE and EXPLOSION,1.28E+11,128000000000,,,,,,,,,,18.1AB,DIRECT-TAIWAN SOUTH ,Manufacture of Woven Tapes,  ,
10000249,20003544,HYYMTLIPDR,"NAGASE VIETNAM CO., LTD","DRAGON LOGISTICS CO., LTD - BONDED WAREHOUSE, Lot F4-5, Thang Long 2 IP, Yen My District, Hung Yen",VH,JPN,E,IF,27/10/2021,03/06/2021,02/06/2022,ARC - PROPERTY ALL RISKS,3,ARB - PROPERTY ALL RISKS,9050000,209000000000,20190124,,20190124,,,,,,,17.1B,DIRECT HANOI,"Trading-Plastic Resin, Parts, Paint and Thinner",  ,
10005873,20021820,BDDAB24445,"YANMAR AGRICULTURAL MACHINERYVIETNAM CO., LTD","Nippon Konpo HCMC - Warehouse, B2-44, 45, 46, 47 Rd 1, Tan Dong Hiep B IZ, Di An, Binh Duong",VC,JPN,D,IF,09/06/2021,08/06/2021,07/06/2022,ISR - INDUSTRIAL ALL RISKS,6,ARB - PROPERTY ALL RISKS,42000000000,42000000000,,,,,,,,,,17.2A,DIRECT HCM,Sales and service of agricultural machinery,  ,
10003199,20011912,HYYMMHTSKV,TSK VIETNAM COMPANY LIMITED,"TSK VIETNAM COMPANY LIMITED, Nghia Hiep Commune, Yen My District,, Hung Yen",VH,JPN,E,IF,28/06/2021,11/06/2021,10/06/2022,ISR - INDUSTRIAL ALL RISKS,1,ARB - PROPERTY ALL RISKS,21345881646,21345881646,20160406,,,,,20160406,,,,18.1AB,DIRECT HANOI,Manufacturing plastic & carton packing,  ,"Low SI, as per new guideline"
10007145,20026440,QNDBDNHANA,"HANACANS JSC.,","Hanacans Jsc - New factory, Lot 15, Dien Nam Dien Ngoc IP, Dien Ban, Quang Nam",VH,JPN,C,IF,31/07/2021,13/06/2021,12/06/2022,ISR - INDUSTRIAL ALL RISKS,5,ARB - PROPERTY ALL RISKS,1.14E+12,1140000000000,,,,,,,,,,18.2A,DIRECT HANOI,As Described above,Sales and Manufacturing of Aluminum cans for Drink  ,
10018299,20043164,HYVLPNE206,"SHINMEI VIETNAM CO.,LTD","TENTAC (HA NOI) CO.,LTD, Road 206, Section( Lot) E, Pho Noi A IP, Van Lam, Hung Yen",VH,JPN,E,IF,13/06/2021,13/06/2021,12/06/2022,ISR - INDUSTRIAL ALL RISKS,1,ARB - PROPERTY ALL RISKS,19276431464,19276431464,,,,,,,,,,18.1AB,DIRECT HANOI,Manufacturing of aluminum box,  ,"Low SI, as per new guideline; going to move to another location"
10000949,20016447,DNBHLBFUJI,"FUJI CARBON (VIETNAM) CO., LTD","Fuji Carbon (Vietnam) Co., Ltd, Lot 232, Amata IP, Long Binh, Bien Hoa, Dong Nai",VC,JPN,E,IF,15/06/2021,15/06/2021,14/06/2022,ISR - INDUSTRIAL ALL RISKS,1,ARB - PROPERTY ALL RISKS,1.43E+11,143000000000,20180418,,,20180418,,,20150608,,,18.2A,DIRECT HCM,Carbon Brushes Manufacturer,  ,"Last survey 2021, postpone to 2023"
10000231,20000597,THTHLMIP67,"SAKURAI VIETNAM CO., LTD.","SAKURAI VIETNAM CO. LTD-Factories 4, 5, 6, 7, 8, 9, Plot F2, Zone F, Le Mon IP, Thanh Hoa, Thanh Hoa",VH,JPN,D,IF,15/06/2021,15/06/2021,14/06/2022,ISR - INDUSTRIAL ALL RISKS,1,ARB - PROPERTY ALL RISKS,136248227,3140000000000,20180405,,,20180405,,,,20141113,,18.1AB,DIRECT HANOI,Producing Inner wear,  ,
10004399,20016555,BDBCMP3L1E,NANSHIN SEIKI (VIETNAM) COMPANY LIMITED,"NANSHIN SEIKI (VIETNAM) COMPANY LIMITED, Lot B-1E-CN, My Phuoc 3 IZ, Ben Cat District, Binh Duong",VC,JPN,E,IF,18/06/2021,18/06/2021,17/06/2022,ISR - INDUSTRIAL ALL RISKS,1,ARB - PROPERTY ALL RISKS,3891591,89701172550,,,,,,,,,,18.1AB,TOYOTA TSUSHO-BRK-VC,As mentioned above,"Manufacturing of electronic components, metal mold  ",
10003178,20012153,BHLBAM13FU,"FUKUVI VIETNAM CO., LTD.","FUKUVI VIETNAM CO., LTD, Plot 510, Road 13, Amata IP, Long Binh, Bien Hoa, Dong Nai",VC,JPN,E,IF,25/06/2021,24/06/2021,23/06/2022,ISR - INDUSTRIAL ALL RISKS,1,ARB - PROPERTY ALL RISKS,7516197,173000000000,20190621,,20190621,,,20160516,,,,18.1AB,DIRECT HCM,Manufacturer of Plastic Panel,  ,
10000300,20003776,DNBHMITSUB,"MITSUBA VIETNAM CO., LTD","MITSUBA M-TECH VIETNAM CO., LTD., D5-1, Long Binh Techno Park (LOTECO) EPZ, Bien Hoa, Dong Nai",VC,JPN,C,IF,26/06/2021,26/06/2021,25/06/2022,ISR - INDUSTRIAL ALL RISKS,1,ARB - PROPERTY ALL RISKS,2.05E+12,2050000000000,,,,,,,,,,18.1AB,DIRECT HCM,As mentioned above,"Starting Motor, Generator for Motorbike Manufacturing  ",
10025629,20051804,LADHHSIZCA,"CHEER ASCENT (VIET NAM) HOME TEXTILES PRODUCTS CO., LTD","CHEER ASCENT (VIETNAM) HOME TEXTILES PRODUCTS, Lo B3A-5, Road No1, Hai Son IZ, Duc Hoa, Long An",MS,CNY,D,IF,01/07/2021,01/07/2021,30/06/2022,FEC - FIRE AND EXPL COMP,1,FEC - COMPULSORY FIRE and EXPLOSION,22523192993,22523192993,,,,,,,,,,18.1AB,DIRECT-TAIWAN SOUTH ,Mattress,  ,
10013994,20034810,BDBBLUBB3B,"CHEN HO (VIET NAM) TEXTILE THREAD CO., LTD.","CHEN HO VIET NAM TEXTILE THREAD CO.,LTD, B-3B-CN,Bau Bang IP,Lai Uyen,Bau Bang, Binh Duong",MS,TWN,E,IF,01/07/2021,01/07/2021,30/06/2022,FEC - FIRE AND EXPL COMP,1,FEC - COMPULSORY FIRE and EXPLOSION,20985000000,20985000000,,,,,,,,,,18.1AB,DIRECT-TAIWAN SOUTH ,Textiles Thread for Shoes,  ,
10000224,20003059,HPADNHIZJ2,"CITIZEN MACHINERY VIETNAM CO.,LTD","CITIZEN MACHINERY VIETNAM CO., LTD, LP J2, J3 Nomura Hai Phong IZ, An Duong, Hai Phong",VH,JPN,C,IF,01/07/2021,01/07/2021,30/06/2022,ISR - INDUSTRIAL ALL RISKS,1,ARB - PROPERTY ALL RISKS,21405843,493000000000,20200103,20200103,,,20170228,,,,,18.2A,DIRECT HANOI,Manufacturing metal mold,  ,
10012775,20034820,HDCGLDIZ13,"FUJIKURA KASEI VIETNAM CO., LTD","FUJIKURA KASEI VIETNAM CO., LTD, 13.1, road 10 Cam Dien - Luong Dien IZ, Cam Giang, Hai Duong",VH,JPN,E,IF,10/09/2021,01/07/2021,30/06/2022,ISR - INDUSTRIAL ALL RISKS,2,ARB - PROPERTY ALL RISKS,65611345327,65611345327,,,,,,,,,,18.1AB,DIRECT HANOI,As above mentioned,  ,
10002916,20013092,HNSSQTNB74,"MITSUI KINZOKU CATALYSTS VIETNAM CO., LTD","Mitsui Kinzoku Catalysts Vietnam Co., Ltd, Plot 74 - Noi Bai IZ, Quang Tien, Soc Son, Ha Noi",VH,JPN,D,IF,02/07/2021,01/07/2021,30/06/2022,ISR - INDUSTRIAL ALL RISKS,1,ARB - PROPERTY ALL RISKS,5.03E+11,503000000000,20180809,,,20180809,,,20151208,,,18.2A,DIRECT HANOI,Manufacturing Exhaust filters,  ,
10000035,20002820,HNDATLPNVN,"PANASONIC INDUSTRIAL DEVICES VIETNAM CO.,LTD","Panasonic Vietnam Co., Ltd, Lot J1-J2 Thang Long IP, Dong Anh, Ha Noi",VH,JPN,C,IF,03/07/2021,01/07/2021,30/06/2022,ISR - INDUSTRIAL ALL RISKS,1,ARB - PROPERTY ALL RISKS,39288610,906000000000,20160907,,,,,20160907,,,,18.1AB,PANASONIC INS-AGT-VH,As described above,"Producing cable turner, mobile phone speaker, others electronic devices ",
10000010,20000721,DNBHAMTIZ,"QUADRILLE VIETNAM CO., LTD.","QUADRILLE VIETNAM CO., LTD., No.118, Amata IZ, Bien Hoa City, Dong Nai",VC,JPN,D,IF,01/07/2021,01/07/2021,30/06/2022,ISR - INDUSTRIAL ALL RISKS,1,ARB - PROPERTY ALL RISKS,1.16E+11,116000000000,20150514,,,,,,20150514,,,18.1AB,DIRECT HCM,Garment,  ,
10043646,20070783,HNDTDVFJST,"TSUJITOMI VIETNAM CO.,LTD","FUJI STAR ROOF CO., LTD, CN04+08, Dong Van 3 IZ, Tien Noi, Duy Tien, Ha Nam",VH,JPN,D,IF,01/07/2021,01/07/2021,30/06/2022,ISR - INDUSTRIAL ALL RISKS,1,ARB - PROPERTY ALL RISKS,21665417500,21665417500,,,,,,,,,,18.1AB,DIRECT HANOI,Manufacturing of non-woven fabric,  ,
10001565,20012529,BDDAYAZAKI,"YAZAKI EDS VIETNAM CO., LTD.","YAZAKI EDS VIETNAM (YEV.)- Location 1, Di An Commune, Di An District, Binh Duong",VC,JPN,C,IF,05/07/2021,01/07/2021,30/06/2022,ISR - INDUSTRIAL ALL RISKS,1,ARB - PROPERTY ALL RISKS,47214833,1090000000000,,,,,,,,,,18.2A,DIRECT HCM,As described above,Manufacturing Automobile Wiring Harness and/or components and others ,
10001551,20012396,HPADYAZAKI,"YAZAKI HAIPHONG VIETNAM CO., LTD","YAZAKI HAIPHONG VIETNAM (YHV.), Lot L, Nomura Hai Phong IZ, An Duong, Hai Phong",VH,JPN,C,IF,01/07/2021,01/07/2021,30/06/2022,ISR - INDUSTRIAL ALL RISKS,1,ARB - PROPERTY ALL RISKS,65036685,1500000000000,,,,,,,,,,18.2A,DIRECT HANOI,As mentioned above,Manufacturing Automobile Wiring Harness and/or components and others ,
10000284,20000885,HNSSZAMIL,"ZAMIL STEEL BUILDINGS VIETNAMCO., LTD","ZAMIL STEEL BUILDINGS VIETNAM CO., LTD, Noi Bai Road 1, Noi Bai IZ, Quang Tien, Soc Son, Ha Noi",VH,JPN,B,IF,01/07/2021,01/07/2021,30/06/2022,ISR - INDUSTRIAL ALL RISKS,1,ARB - PROPERTY ALL RISKS,46103086,1060000000000,20200730,20200730,,,20170301,,,,,18.2A,DIRECT HANOI,Manufacture & Erect Pre-engineered steel bldgs,Manufacture & Erect Pre-engineered steel buildings  ,
10093190,20094280,HNKBDVZDL,ZDL (VIET NAM) COMPANY LIMITED,"ZDL (Vietnam) Company Limited, Dong Van IV IP, Dai CUong, Kim Bang Dist, Ha Nam",VH,CNY,C,IF,02/07/2021,01/07/2021,30/06/2022,ISR - INDUSTRIAL ALL RISKS,1,ARB - PROPERTY ALL RISKS,5190214,119000000000,,,,,,,,,,18.2A,DIRECT HANOI,As below,Processing and assembling audio and electronic equipment  ,
10025752,20051882,SGBTTTIZTH,CONG TY TNHH TY THAC-CHI NHANHTAI TP. HO CHI MINH,"TY THAC CO., LTD - HCM BRANCH, 9A, Lot 9, Road C, Tan Tao IZ, Binh Tan, HCMC",MS,TWN,E,IF,03/07/2021,03/07/2021,02/07/2022,ISR - INDUSTRIAL ALL RISKS,1,ARB - PROPERTY ALL RISKS,19221942051,19221942051,,,,,,,,,,18.1AB,DIRECT-TAIWAN SOUTH ,Design center for sport shoes,Design center for sport shoes  ,
10022833,20049427,VLBMBMIZTB,"TY BACH CO., LTD","TY BACH CO., LTD, Lot D, Binh Minh IZ, My Hoa Village, Binh Minh, Vinh Long",MS,TWN,E,IF,06/07/2021,06/07/2021,05/07/2022,ISR - INDUSTRIAL ALL RISKS,1,ARB - PROPERTY ALL RISKS,7.68E+11,768000000000,,,,,,,,,,18.1CB,DIRECT-TAIWAN SOUTH ,Sport shoes,  ,
10008683,20095259,HNTTHBPNAM,CONG TY TNHH NGOI NHA DIEN TU,"Nam Khai Warehouse, Ha Binh Phuong IZ, Province Rd 427, Thuong Tin, Ha Noi",BB,VNM,D,IF,10/07/2021,09/07/2021,08/07/2022,ISR - INDUSTRIAL ALL RISKS,1,ARB - PROPERTY ALL RISKS,48000000000,48000000000,,,,,,,,,,17.1B,SCB-AGENT-BANCA SOUTH        ,Electronics,  ,
10044573,20071754,BDBB6C1SWR,SWR COMPANY LIMITED,"SWR COMPANY LIMITED, Lot A_6C1_CN, Bau Bang IZ, Lai Uyen, Bau Bang, Binh Duong",MS,TWN,D,IF,09/07/2021,09/07/2021,08/07/2022,FEC - FIRE AND EXPL COMP,1,FEC - COMPULSORY FIRE and EXPLOSION,32200000000,32200000000,,,,,,,,,,18.1AB,DIRECT-TAIWAN SOUTH ,As Described above,Manufacturer of rubber conveyor belt  ,
10017707,20052168,DNBHLBNANC,CONG TY CO PHAN THIET BI DIENPHUOC THANH,"Cong ty TNHH MTV Nanoco, Lot 243, Road 12, Amata IZ, Long Binh, Bien Hoa, Dong Nai",VC,VNM,C,IF,19/10/2021,12/07/2021,11/07/2022,ISR - INDUSTRIAL ALL RISKS,6,ARB - PROPERTY ALL RISKS,59714292294,59714292294,,,,,,,,,,17.2A,DIRECT HCM,Manufacture and trading of electrical products,  ,
