Clt_No,Po_No,Accumulate,Insuredname,Risklocation,DIV,CTR,CLS,STT,Effectivedate,Inceptiondate,Renewdate,Contracttype,Rkn,Risktype,OriginalSI,VNDSI,Survey date1,Survey date 2,Survey date 3,Survey date 4,Survey date 5,Survey date 6,Survey date 7,Survey date 8,Survey date 9,Fire code,Agentname,Occupation,BusinessLine,Remark
10001402,20010554,HGCTTPTLTD,"LAC TY II CO., LTD","Lac Ty II Co.,- Factory D,R1,R2,canteen(20m fr A), Lot B1, B2 Tan Phu Thanh IZ, Chau Thanh A, Hau Giang",MS,TWN,D,RR,01/01/2022,01/01/2021,31/12/2021,ISR - INDUSTRIAL ALL RISKS,3,ARB - PROPERTY ALL RISKS,7.63E+11,763000000000,20191129,,20191129,,20171124,,,,,18.1CB,DIRECT-TAIWAN SOUTH ,Sport shoes,  ,
10000172,20019830,BDDATDHDAR,MARUICHI SUN STEEL JOINT STOCKCOMPANY,"MARUICHI SUN STEEL JOINT STOCK COMPANY- RIGHT SIDE, 743 lot A, Dong An, Tan Dong Hiep, Di An,, Binh Duong",VC,JPN,B,RR,01/01/2022,01/01/2021,31/12/2021,ISR - INDUSTRIAL ALL RISKS,1,ARB - PROPERTY ALL RISKS,197073906,4560000000000,20171215,,,,20171215,,,,,18.2A,TOYOTA TSUSHO-BRK-VC,Steel manufacture,  ,
10006136,20038371,BDDASTR6LG,"MEITO VIETNAM CO., LTD.","MEITO VIETNAM CO., LTD, Lot G, Road No 6, Song Than IP 2, Di An, Binh Duong",VC,JPN,C,RR,01/01/2022,30/11/2021,31/12/2021,ISR - INDUSTRIAL ALL RISKS,1,ARB - PROPERTY ALL RISKS,2.24E+11,224000000000,,,,,,,,,,17.1B,DIRECT HCM,Logistics,Logistics  ,
10000773,20019457,HNDATLMITS,"MITSUBISHI PENCIL VIETNAM CO.,LTD","Mitsubishi Pencil Vietnam Co., Ltd, C-7, Thang Long IP, Dong Anh, Ha Noi",VH,JPN,C,RR,01/01/2022,01/01/2021,31/12/2021,ISR - INDUSTRIAL ALL RISKS,1,ARB - PROPERTY ALL RISKS,4.35E+11,435000000000,20180817,,,20180817,,,,,,18.2A,DIRECT HANOI,Producing marker pen & related activities,  ,
10000605,20002424,HYYMTLC6NI,NIKKISO VIETNAM INC.,"NIKKISO VIETNAM INC., Plot No. C6, Thang Long 2 IP, Yen My District, Hung Yen",VH,JPN,D,RR,01/01/2022,01/01/2021,31/12/2021,ISR - INDUSTRIAL ALL RISKS,1,ARB - PROPERTY ALL RISKS,101520578,2350000000000,20171204,,,,20171204,,,,,18.2A,MARSH-BRK-VH,Manufacturing Airplane Parts,Manufacturing Airplane Parts  ,
10001195,20004969,HNDATLOGIN,OGINO VIETNAM CORPORATION,"OGINO Vietnam Corporation, N9-Thang Long IP, Dong Anh, Ha Noi",VH,JPN,C,RR,01/01/2022,01/01/2021,31/12/2021,ISR - INDUSTRIAL ALL RISKS,1,ARB - PROPERTY ALL RISKS,7.85E+11,785000000000,20180928,,,20180928,,,,,,18.2A,DIRECT HANOI,Producing aluminum parts for machinery,  ,
10014591,20038525,BNTSPCS8N6,OGINO VIETNAM TU SON COMPANY LIMITED,"OGINO VIETNAM TU SON COMPANY LIMITED, No.06, 08 Str., VSIP Bac Ninh, Phu Chan, Tu Son, Bac Ninh",VH,JPN,C,RR,01/01/2022,01/01/2021,31/12/2021,ISR - INDUSTRIAL ALL RISKS,1,ARB - PROPERTY ALL RISKS,6.71E+11,671000000000,,,,,,,,,,18.2A,DIRECT HANOI,Producing metal parts for machinery,  ,
10003743,20014551,DNLTLDIPPE,"PEGASUS SHIMAMOTO AUTO PARTS (VIETNAM) CO., LTD.","PEGASUS SHIMAMOTO AUTO PARTS CO.,LTD, Long Duc IP, Long Duc Ward, Long Thanh, Dong Nai",VC,JPN,C,RR,01/01/2022,01/01/2021,31/12/2021,ISR - INDUSTRIAL ALL RISKS,1,ARB - PROPERTY ALL RISKS,10182217,236000000000,,,,,,,,,,18.2A,DIRECT HCM,Auto Part Manufacturing,  ,
10000346,20001064,DNBHAIPSHI,SHISEIDO VIETNAM INC,"SHISEIDO VIETNAM CO., LTD, Lot 231-233-235-237, Amata IP, Long Binh, Bien Hoa, Dong Nai",VC,JPN,C,IF,02/01/2021,01/01/2021,31/12/2021,ISR - INDUSTRIAL ALL RISKS,1,ARB - PROPERTY ALL RISKS,1.31E+12,1310000000000,20180117,,,20180117,,20160706,,,,18.1AB,MARSH-BRK-VC,As above,Cosmetic Manufacturer and all other related activities.  ,
10000051,20001805,HNDATLIPMF,"SUMITOMO HEAVY INDUSTRIES (VIETNAM) CO.,LTD","SUMITOMO HEAVY INDUSTRIES (VIETNAM) CO., LTD - MF, I-7-8-9, Thang Long IP, Dong Anh, Ha Noi",VH,JPN,C,RR,01/01/2022,01/01/2021,31/12/2021,ISR - INDUSTRIAL ALL RISKS,1,ARB - PROPERTY ALL RISKS,38293151,886000000000,20180921,,,20180921,,,20151016,,20130828,18.2A,DIRECT HANOI,Producing Electric motor for machinery,  ,
10000691,20010432,DNBHSHOWPL,"TENMA (HCM) VIETNAM CO., LTD","TENMA (HCM) VIETNAM CO., LTD., No.10, Road 9A, Bien Hoa 2 IZ, Bien Hoa City, Dong Nai",VC,JPN,E,RR,01/01/2022,01/01/2021,31/12/2021,ISR - INDUSTRIAL ALL RISKS,1,ARB - PROPERTY ALL RISKS,5.38E+11,538000000000,20170727,,,,20170727,,,20141222,,18.1AB,AON-BRK-VC,As mentioned above,"Principally manufacturing of plastic products, plastic injection and blow moulded mass production for Electrical appliances, Motorcycles, Industrial plastic",
10000084,20003053,BDBCTDTOCO,"TOSHIBA VIETNAM CONSUMER PRODUCTS CO., LTD","TOSHIBA VIETNAM CONSUMER PRODUCTS CO., LTD, Xa Tan Dinh, Huyen Ben Cat, Binh Duong",VC,JPN,C,RR,01/01/2022,01/01/2021,31/12/2021,ISR - INDUSTRIAL ALL RISKS,9,ARB - PROPERTY ALL RISKS,2.51E+11,251000000000,20140604,,,,,,,20140604,,18.1AB,AON-BRK-VC,As above,"Manufacturing and assembling color TV, color TV parts, and all other activities incidental thereto. ",
10000245,20011951,DNBHLBL101,"TOYO INK VIETNAM CO., LTD","TOYO INK  VIETNAM CO., LTD., Plot 201, Long Binh Techno Park, Bien Hoa, Dong Nai",VC,JPN,E,RR,01/01/2022,01/01/2021,31/12/2021,ISR - INDUSTRIAL ALL RISKS,1,ARB - PROPERTY ALL RISKS,1.75E+11,175000000000,20180212,,,20180212,,20160909,,,20131121,18.1AB,DIRECT HCM,Ink Manufacturer,  ,
10005148,20016356,QNSTTPVSIP,URC CENTRAL CO. LTD,"URC CENTRAL CO. LTD, No. 8 VSIP Quang Ngai Street A4, Son Tinh, Quang Ngai",VC,PHL,B,RR,01/01/2022,01/12/2020,31/12/2021,ISR - INDUSTRIAL ALL RISKS,1,ARB - PROPERTY ALL RISKS,7380000,171000000000,20180806,,,20180806,,,20150908,,,18.2A,AON-BRK-VC,As Described above,"Principally manufacture of candies, snacks, chocolate, biscuits, wafers, nonalcoholic beverage and other food related products and all other incidental activities",
10002494,20009863,HNQOTTURC,"URC HANOI CO.,LTD","URC HANOI CO.,LTD, Lot CN 2.2, Thach That IP - Quoc Oai, Ha Noi",VC,JPN,B,RR,01/01/2022,01/12/2020,31/12/2021,ISR - INDUSTRIAL ALL RISKS,1,ARB - PROPERTY ALL RISKS,22620000,524000000000,20140822,,,,,,,20140822,,18.2A,AON-BRK-VC,As Described above,"Principally manufacture of candies, snacks, chocolate, biscuits, wafers, nonalcoholic beverage and other food related products and all other incidental activities",
10002491,20009860,BDTAVSIP26,URC VIETNAM CO. LTD.,"URC VIETNAM CO. LTD, No. 26, Road 6, VSIP 1, Thuan An District, Binh Duong",VC,PHL,B,RR,01/01/2022,01/12/2020,31/12/2021,ARC - PROPERTY ALL RISKS,1,ARB - PROPERTY ALL RISKS,46020000,1070000000000,20170419,,,,20170419,,,20140225,,18.2A,AON-BRK-VC,As described above,"Principally manufacture of candies, snacks, chocolate, biscuits, wafers, nonalcoholic beverage and other food related products and all other incidental activities",
10000037,20002326,BDTAVSVIKU,"VIETNAM KURAUDIA CO., LTD.","VIETNAM KURAUDIA CO., LTD, 01 VSIP Street 7, VSIP, Thuan An, Binh Duong",VC,JPN,D,RR,01/01/2022,01/01/2021,31/12/2021,ISR - INDUSTRIAL ALL RISKS,1,ARB - PROPERTY ALL RISKS,34572230429,34572230429,20181115,,,20181115,,,20151105,,,18.1AB,DIRECT HCM,Manufacturing of wedding dress,Manufacturing of wedding dress  ,
10009594,20086386,HTKAVAVIJA,VIJACHIP VUNG ANG CORPORATION.,"VIJACHIP VUNG ANG CORPORATION-Location 1, Vung Ang Economic Zone, Ky Anh,, Ha Tinh",VC,JPN,E,RR,01/01/2022,01/01/2021,31/12/2021,ISR - INDUSTRIAL ALL RISKS,1,ARB - PROPERTY ALL RISKS,2186659,50730488800,,,,,,,,,,18.1BB,DIRECT HCM,Manufacturing paper materials to be exported,  ,
10000667,20002376,DNBHWATABE,"WATABE WEDDING VIETNAM CO., LTD","WATABE WEDDING VIETNAM CO., LTD, Lot 200, AMATA IP, Bien Hoa City, Dong Nai",VC,JPN,D,RR,01/01/2022,01/01/2021,31/12/2021,ISR - INDUSTRIAL ALL RISKS,1,ARB - PROPERTY ALL RISKS,7716306,179000000000,20160805,,,,,20160805,,,,18.1AB,MARSH-BRK-VC,Manufacturing of garment (wedding dress),Manufacturing of garment (wedding dress) and all other related activities ,
10000006,20002382,HNSSTGYMHV,"YAMAHA MOTOR VIETNAM CO., LTD","YAMAHA MOTOR VIETNAM CO., LTD, Trung Gia Commune, Soc Son District, Ha Noi",VH,JPN,C,RR,01/01/2022,01/01/2021,31/12/2021,ISR - INDUSTRIAL ALL RISKS,1,ARB - PROPERTY ALL RISKS,2.13E+12,2130000000000,20161107,,,,,20161107,,,,18.1AB,DIRECT HANOI,Manufacturing & assembling motorcycles,  ,
10001058,20004231,BGVYDTD5D6,"YOKOI MOULD VIETNAM CO., LTD.","YOKOI MOULD VIETNAM CO., LTD., Plot D5-D6, Dinh Tram  IZ, Viet Yen Dist, Bac Giang",VH,JPN,E,RR,01/01/2022,01/01/2021,31/12/2021,ISR - INDUSTRIAL ALL RISKS,1,ARB - PROPERTY ALL RISKS,1.71E+11,171000000000,20190918,,20190918,,,20160909,,,,18.1AB,DIRECT HANOI,Design & Manufacturing Mould,Design & Manufacturing Mould  ,
10000386,20019236,SGD1ZENPLA,ZEN PLAZA COMPANY LTD.,"ZEN PLAZA BUILDING, 54 - 56 Nguyen Trai Street, District 1, HCMC",VC,JPN,A,RR,01/01/2022,01/01/2021,31/12/2021,ISR - INDUSTRIAL ALL RISKS,1,ARB - PROPERTY ALL RISKS,1.53E+11,153000000000,20201105,20201105,,,,20160727,,,,5.1A,DIRECT HCM,"Office leasing, retailing",  ,
10021609,20047862,VPBXTLC891,"TSUCHIYA TSCO (HA NOI) CO., LTD","TSUCHIYA TSCO (HA NOI) CO., LTD, C8,9,10, Thang Long IZ, Thien Ke, Binh Xuyen, Vinh Phuc",VH,JPN,D,IF,11/10/2021,04/01/2021,03/01/2022,ISR - INDUSTRIAL ALL RISKS,1,ARB - PROPERTY ALL RISKS,9369515,217000000000,,,,,,,,,,18.1AB,DIRECT HANOI,As above mentioned,Manufacturing brush for electronic equipment and other products ,
10004256,20014547,BPCTTTCTA6,"MEGATEC CO., LTD","MEGATEC CO., LTD., LOT A6.4 A6.8 CHON THANH IZ, THANH TAM, CHON THANH, Binh Phuoc",VC,JPN,E,IF,11/01/2021,10/01/2021,09/01/2022,ISR - INDUSTRIAL ALL RISKS,1,ARB - PROPERTY ALL RISKS,71327565984,71327565984,20190315,,20190315,,,20161011,,20141223,,18.1AB,DIRECT HCM,Manufacturing of wood plate for furniture,  ,
10000690,20019537,DNNTPKSOPE,SOPET GAS ONE COMPANY LIMITED,"SOPET GAS CO., LTD, Phuoc Khanh Village, Nhon Trach District, Dong Nai",VC,JPN,E,IF,20/04/2021,12/01/2021,11/01/2022,ISR - INDUSTRIAL ALL RISKS,1,ARB - PROPERTY ALL RISKS,1.1E+11,110000000000,20181106,,,20181106,,20161107,20151104,,,19.1B,DIRECT HCM,Export/ Import and sell LPG (gas),  ,
10000699,20002451,BDBCMPTAIS,"TAISEI BIJUTSU PRINTING (VIETNAM) CO., LTD.","TAISEI BIJUTSU PRINTING (VIETNAM) CO., LTD, Lot D-8F2-CN, My Phuoc 3 IP, Ben Cat, Binh Duong",VC,JPN,E,IF,15/01/2021,14/01/2021,13/01/2022,ISR - INDUSTRIAL ALL RISKS,1,ARB - PROPERTY ALL RISKS,78586643905,78586643905,20200106,20200106,20191218,,,20160921,,,,18.1AB,DIRECT HCM,Printing workshop/ factory,  ,
10000714,20010494,DNBHAMSAKA,SAKAGUCHI PLASTIC VIETNAM,"SAKAGUCHI PLASTIC VIETNAM, Road 7A, Lot 300, Amata IP, Long Binh, Bien Hoa, Dong Nai",VC,JPN,E,IF,26/05/2021,15/01/2021,14/01/2022,ISR - INDUSTRIAL ALL RISKS,2,ARB - PROPERTY ALL RISKS,1.45E+11,145000000000,,,,,,,,,,18.1AB,DIRECT HCM,Manufacturer of Plastic Parts,  ,
10000161,20002479,BDTAAPTNTF,"VIETNAM TNT FIBERS CO., LTD.","VIETNAM TNT FIBERS CO., LTD., 743 Street, An Phu Village, Thuan An District, Binh Duong",VC,JPN,E,IF,15/01/2021,15/01/2021,14/01/2022,ISR - INDUSTRIAL ALL RISKS,1,ARB - PROPERTY ALL RISKS,33254946077,33254946077,20191227,,20191227,,20170120,20160928,,20140528,,18.1AB,DIRECT HCM,Nylon Twine Manufacture,Nylon Twine Manufacture  ,
10021803,20048067,HNDTHMKURO,"KUROSU HANAM CO.,LTD","KUROSU HANAM CO., LTD, Road D1,Section E,Hoa Mac IP,Chau Giang, Duy Tien, Ha Nam",VH,JPN,E,IF,01/07/2021,16/01/2021,15/01/2022,ISR - INDUSTRIAL ALL RISKS,1,ARB - PROPERTY ALL RISKS,58827256000,58827256000,,,,,,,,,,18.1AB,DIRECT HANOI,Manufucture of Textile Fabrics and Textile,  ,
10000276,20020003,SGD7S3738A,"JAPAN PAPER TECHNOLOGY CO., LTD.","JAPAN PAPER TECHNOLOGY CO., LTD, S37-38a Road 19, Tan Thuan EPZ, District 7, HCMC",VC,JPN,E,IF,18/01/2021,17/01/2021,16/01/2022,ISR - INDUSTRIAL ALL RISKS,1,ARB - PROPERTY ALL RISKS,2214200,51214446000,20170606,,,,20170606,20160915,,,,18.1AB,DIRECT HCM,Paper Bags Manufacturer,  ,
10012513,20031530,HNDTHMSAN2,"VIETNAM KYODO SEIHAN PRINTINGCO., LTD","Naxis Vietnam Co., Ltd - Hanam Branch, Road N2, Section A, Hoa Mac IP, Duy Tien, Ha Nam",VH,JPN,E,IF,20/01/2021,20/01/2021,19/01/2022,ISR - INDUSTRIAL ALL RISKS,1,ARB - PROPERTY ALL RISKS,1.1E+11,110000000000,20181108,,,20181108,,,,,,18.1AB,DIRECT HANOI,Printing,  ,
10002652,20019835,SGBTTAHYOG,"HYOGO SHOES VIETNAM CO., LTD.","HYOGO SHOES CO., LTD, B7/114A Nguyen Cuu Phu, Ward Tan A, Binh Tan Dist, HCMC",VC,JPN,D,IF,24/01/2021,23/01/2021,22/01/2022,ISR - INDUSTRIAL ALL RISKS,1,ARB - PROPERTY ALL RISKS,237397376,52702217472,20191210,,20191210,,,,,20140114,,18.1CB,DIRECT HCM,Shoes manufacturer,  ,
10021972,20048389,BDBCMPTOYO,TOYOTA TSUSHO FASHION EXPRESSVIETNAM COMPANY LIMITED,"TOYOTA TSUSHO FASHION EXPRESS VIETNAM Co., Ltd, B_3B4_CN, My Phuoc 3 IZ, Thoi Hoa Ward, Ben Catwn, Binh Duong",VC,JPN,D,IF,23/01/2021,23/01/2021,22/01/2022,ISR - INDUSTRIAL ALL RISKS,1,ARB - PROPERTY ALL RISKS,51239496507,51239496507,,,,,,,,,,18.1AB,TOYOTA TSUSHO-BRK-VC,Garments (uniform and Sport Casual Production),  ,
10012047,20031615,HNDTDV2NIS,"NISSHO VIETNAM CO., LTD","NISSHO VIETNAM CO., LTD, Dong Van 2 IZ, Duy Tien, Ha Nam",VH,JPN,E,IF,24/01/2021,24/01/2021,23/01/2022,ISR - INDUSTRIAL ALL RISKS,1,ARB - PROPERTY ALL RISKS,1.19E+11,119000000000,20191126,,20191126,,,,,,,18.1AB,DIRECT HANOI,Manufacture of motor parts,  ,
10012244,20031611,HNDAP-6B25,"OB KOGYO CO., LTD (VN)","OB KOGYO CO., LTD (VN), SF Bld No. 25, Lot P-6B Thang Long IP, Dong Anh, Ha Noi",VH,JPN,E,IF,25/01/2021,25/01/2021,24/01/2022,ISR - INDUSTRIAL ALL RISKS,1,ARB - PROPERTY ALL RISKS,19905956895,19905956895,,,,,,,,,,18.1AB,DIRECT HANOI,Manufacture spare parts in plastic,Manufacture spare parts in plastic  ,
10000694,20019839,SGD7TTTANA,"TANAKA CO.,LTD","TANAKA CO., LTD., Road No 6, Tan Thuan EPZ, District 7, HCMC",VC,JPN,D,IF,26/01/2021,25/01/2021,24/01/2022,ISR - INDUSTRIAL ALL RISKS,1,ARB - PROPERTY ALL RISKS,4193743,97127087880,20190114,,20190114,,,,,,,18.1AB,DIRECT HCM,Production of alcohol and others,Production of alcohol and others  ,
10007383,20045738,SGTDLTSAGA,SG SAGAWA VIET NAM,"SAGAWA EXPRESS VIETNAM, Lot 117, Linh Trung EPZ, Thu Duc, HCMC",VC,JPN,D,IF,27/01/2021,27/01/2021,26/01/2022,ISR - INDUSTRIAL ALL RISKS,1,ARB - PROPERTY ALL RISKS,4409643,102000000000,,,,,,,,,,17.1B,DIRECT HCM,Warehousing & Transportation,  ,
10005953,20019737,DNLTLDIPH5,"KOATSU GAS KOGYO VIETNAM CO.,LTD","KOATSU GAS KOGYO VIETNAM Co., Ltd., Lot No H-5, Long Duc IP, Long Thanh, Dong Nai",VC,JPN,E,IF,29/01/2021,29/01/2021,28/01/2022,ISR - INDUSTRIAL ALL RISKS,1,ARB - PROPERTY ALL RISKS,10490000,242000000000,20190710,,20190710,,,20161014,,,,18.1AB,DIRECT HCM,Manufacturing and distribution of bond,  ,
10000972,20014563,LABLPATVIN,"VINA ECO BOARD CO., LTD","VINA ECO BOARD CO., LTD., D2-D7 Phu An Thanh IP,An Thanh,Ben Luc Dist., Long An",VC,JPN,E,IF,01/02/2021,31/01/2021,30/01/2022,ISR - INDUSTRIAL ALL RISKS,1,ARB - PROPERTY ALL RISKS,1.92E+12,1920000000000,20190620,,20190620,20180711,20170707,,,,,18.1BB,AON-BRK-VC,As mentioned below,"Principally manufacturing, processing and trading all kinds of wooden products including raw particle board and all other activities incidental thereto",
10045531,20086554,LADHDINGTA,DINGTAI INDUSTRIAL COMPANY LIMITED,"DINGTAI INDUSTRIAL COMPANY LIMITED, Lot B05-1, Duc Hoa 1 IZ, Duc Hoa Dong, Duc Hoa Dis, Long An",MS,CNY,E,IF,01/02/2021,01/02/2021,31/01/2022,FEC - FIRE AND EXPL COMP,1,FEC - COMPULSORY FIRE and EXPLOSION,1.12E+11,112000000000,,,,,,,,,,18.1AB,DIRECT-TAIWAN SOUTH ,Plastic outsole,  ,
10003698,20012882,HPHADVIZYU,"INSTANTA VIETNAM CO., LTD","YUSEN LOGISTICS (VIETNAM) - WAREHOUSE, Lot CN3.3C, Dinh Vu IZ, Hai An, Hai Phong",VH,POL,E,IF,01/02/2021,01/02/2021,31/01/2022,ISR - INDUSTRIAL ALL RISKS,3,ARB - PROPERTY ALL RISKS,1691919,39032571330,,,,,,,,,,18.1AB,DIRECT HANOI,As mentioned above,Processing and packing of instant coffee to export  ,
10000640,20048523,SGD7TTKEEN,"KEEN CHING ZIPPER CO.,LTD","KEEN CHING ZIPPER CO.,LTD, Road 16,Tan Thuan EPZ, District 7, HCMC",MS,TWN,D,IF,01/02/2021,01/02/2021,31/01/2022,FEC - FIRE AND EXPL COMP,1,FEC - COMPULSORY FIRE and EXPLOSION,5300000,122000000000,,,,,,,,,,18.2A,DIRECT-TAIWAN SOUTH ,Zipper,  ,Lapsed
10000317,20001031,HNDATLSUMI,"SUMITOMO NACCO FORKLIFT VIETNAM CO.,LTD","Sumitomo NACCO Materials Handling (Vietnam) Co.,, Lot M1, Thang Long IZ, Dong Anh, Ha Noi",VH,JPN,C,IF,14/09/2021,01/02/2021,31/01/2022,ISR - INDUSTRIAL ALL RISKS,1,ARB - PROPERTY ALL RISKS,5.5E+11,550000000000,20180806,,,20180806,,,,,,18.2A,AEGIS INS BROKERS-BRK-VH,As described above,"Manufacturing Forklift Component (Machining, Assembly) and other related activities ",
10060194,20087239,VPBXTLID10,"TOHKEN VIETNAM MANUFACTURING CO.,LTD.","TOHKEN VIETNAM MANUFACTURING, Lot D10-11-12, Thang Long Vinh Phuc IZ, Thien Ke, Vinh Phuc",VH,JPN,E,IF,01/02/2021,01/02/2021,31/01/2022,ISR - INDUSTRIAL ALL RISKS,1,ARB - PROPERTY ALL RISKS,8700000,201000000000,,,,,,,,,,18.1AB,DIRECT HANOI,Manufacture spare parts in plastic,  ,
10000738,20002578,HPNQLLSUMI,SUMITOMO CORPORATION ASIA & OCEANIA PTE LTD,"VIETRANS HAIPHONG WAREHOUSE, 142 Le Lai, Ngo Quyen, Hai Phong",VH,JPN,D,IF,02/02/2021,02/02/2021,01/02/2022,ARC - PROPERTY ALL RISKS,1,ARB - PROPERTY ALL RISKS,800000,18508000000,,,,,,,,,,17.2A,DIRECT HANOI,Warehouse: Aluminum ingot,  ,"Low SI, as per new guideline"
10000745,20002615,HPADNOKONY,"KONYA PAPER VIETNAM CO., LTD","KONYA PAPER VIETNAM Co., LTD, Land Plot F-11a, Nomura IZ, An Duong, Hai Phong",VH,JPN,E,IF,11/02/2021,08/02/2021,07/02/2022,ISR - INDUSTRIAL ALL RISKS,1,ARB - PROPERTY ALL RISKS,1769291,40826389825,20180208,,,20180208,,,20151118,,20130314,18.1AB,DIRECT HANOI,Cutting & Packing Towel Paper,  ,
10001847,20007610,BNTSTSIZNI,"NISSIN ELECTRIC VIETNAM CO. LTD.,","NISSIN ELECTRIC VIETNAM CO. LTD.,, No.7,TS11 Road,Tien Son IZ, Tu Son, Bac Ninh",VH,JPN,C,IF,24/09/2021,08/02/2021,07/02/2022,ISR - INDUSTRIAL ALL RISKS,3,ARB - PROPERTY ALL RISKS,6.89E+11,689000000000,,,,,,,,,,18.2A,MARSH-BRK-VH,As described above,Manufacturing Electronics and mechanical device components  ,
10060675,20087526,SGTDNDTLP,"LONG PHUOC-HT CO., LTD","LONG PHUOC - HT CO., LTD, 1792 Nguyen Duy Trinh, Truong Thanh, Thu Duc, HCMC",VC,JPN,C,IF,28/05/2021,09/02/2021,08/02/2022,ISR - INDUSTRIAL ALL RISKS,1,ARB - PROPERTY ALL RISKS,2.52E+11,252000000000,,,,,,,,,,8.2B,DIRECT HCM,Car Dealer (Car Sales and Maintenance Service),  ,
10000744,20002613,SGCCNDSHIH,"CONG TY SHIH FA RUBBER INDUSTRIES (VN) CO., LTD","SHIH FA RUBBER INDUSTRIES CO., LTD, Bau Tran Hamlet, Nhuan Duc Commune, Cu Chi Dist, HCMC",MS,TWN,D,IF,15/02/2021,15/02/2021,14/02/2022,FEC - FIRE AND EXPL COMP,1,FEC - COMPULSORY FIRE and EXPLOSION,2250000,52425000000,20191017,,20191017,,20171019,,,,20130110,18.1AB,DIRECT-TAIWAN SOUTH ,Rubber Tire,  ,
10000563,20062292,SGD7TTALWA,"ALWAYS CO., LTD","ALWAYS CO., LTD, Aread A, lot P, Road 16, Tan Thuan EPZ, Dist 7, HCMC",MS,TWN,C,IF,19/02/2021,19/02/2021,18/02/2022,FEC - FIRE AND EXPL COMP,1,FEC - COMPULSORY FIRE and EXPLOSION,10631905,247000000000,,,,,,,,,,18.2A,DIRECT-TAIWAN SOUTH ,Bicycle Manufacture,Bicycle Manufacture  ,
10000252,20020139,BDBCVSIP2M,"MARUHA CHEMICAL VIETNAM CO., LTD.","MARUHA CHEMICAL VIETNAM CO., LTD., No. 56, Street 1, VSIP 2, Ben Cat District, Binh Duong",VC,JPN,E,IF,27/02/2021,27/02/2021,26/02/2022,ISR - INDUSTRIAL ALL RISKS,1,ARB - PROPERTY ALL RISKS,3525000,81374625000,20170317,,,,20170317,,,20140219,,18.1AB,DIRECT HCM,Manufacturing of Plastic,  ,"Last survey 2020, postpone to 2023"
10061171,20088170,BNQVN1VI32,"VIETNAM MUSASHI PAINT CO.,LTD-HA NOI BRANCH","VIETNAM MUSASHI PAINT, VI-3.2, N1, D Street, Que Vo 2 IZ, Ngoc Xa, Que Vo, Bac Ninh",VH,JPN,E,IF,27/02/2021,27/02/2021,26/02/2022,ISR - INDUSTRIAL ALL RISKS,1,ARB - PROPERTY ALL RISKS,63714025669,63714025669,,,,,,,,,,18.1AB,DIRECT HANOI,Mixing paint manufacture,  ,
10000763,20002657,HDCGTTJAGU,JAGUAR INTERNATIONAL CORPORATION HANOI.,"JAGUAR INTERNATIONAL CORPORATION HANOI., Tan Truong IZ, Cam Giang District, Hai Duong",VH,JPN,C,IF,28/02/2021,28/02/2021,27/02/2022,ISR - INDUSTRIAL ALL RISKS,1,ARB - PROPERTY ALL RISKS,6.39E+11,639000000000,20180816,,,20180816,,,,,,18.2A,DIRECT HANOI,Manufacturing home used sewing machine,  ,
10000568,20020209,BDBCMPCHEN,"CHEN TAI (VIET NAM) WOVEN TAPES ENTERPRISE CO.,LTD","CHEN TAI (VIET NAM) WOVEN TAPES, Lot H-1A-CN, Road N8, My Phuoc 1 IZ, Ben Cat, Binh Duong",MS,TWN,D,IF,02/03/2021,01/03/2021,28/02/2022,FEC - FIRE AND EXPL COMP,1,FEC - COMPULSORY FIRE and EXPLOSION,99843371308,99843371308,20190926,,20190926,,20171026,20160202,,,,18.1AB,DIRECT-TAIWAN SOUTH ,Manufacture of Woven Tapes,  ,
10037179,20063169,HNDTDV3CN7,"KATOLEC GLOBAL LOGISTICS VIETNAM CO.,LTD.","OJITEX HAI PHONG COMPANY LIMITED - Ha Nam branch, CN07, Dong Van III IZ, Hoang Dong, Duy Tien, Ha Nam",VH,JPN,D,IF,01/03/2021,01/03/2021,28/02/2022,ISR - INDUSTRIAL ALL RISKS,1,ARB - PROPERTY ALL RISKS,79526830727,79526830727,,,,,,,,,,17.2A,DIRECT HANOI,Warehouse,  ,
10009427,20025620,DNBHLBNAXI,"NAXIS VIETNAM CO.,LTD","NAXIS VIETNAM CO.,LTD, Plot 505, Road 13, Long Binh IZ (Amata), Bien Hoa, Dong Nai",VC,JPN,D,IF,01/03/2021,01/03/2021,28/02/2022,ISR - INDUSTRIAL ALL RISKS,1,ARB - PROPERTY ALL RISKS,84695008507,84695008507,20190327,,20190327,,,20160830,,,,18.1AB,DIRECT HCM,Printing,Printing  ,
10022048,20063134,BRVTCDIZD2,GREENTECH HEADGEAR COMPANY LIMITED,"GREENTECH HEADGEAR COMPANY LIMITED, Road D02, Chau Duc IZ, Nghia Thanh, Chau Duc Dist, Ba Ria Vung Tau",MS,TWN,D,IF,03/03/2021,03/03/2021,02/03/2022,FEC - FIRE AND EXPL COMP,1,FEC - COMPULSORY FIRE and EXPLOSION,1.48E+11,148000000000,,,,,,,,,,18.1AB,DIRECT-TAIWAN SOUTH ,Hat,  ,
10062184,20089016,BDBCPAHITO,HITO PACKING MATERIAL ONE MEMBER COMPANY LIMITED,"HITO PACKING MATERIAL ONE MEMBER COMPANY LIMITED, No. 394, DT 748, Phu An, Ben Cat, Binh Duong",MS,TWN,D,IF,09/03/2021,09/03/2021,08/03/2022,FEC - FIRE AND EXPL COMP,1,FEC - COMPULSORY FIRE and EXPLOSION,23021743309,23021743309,,,,,,,,,,18.1AB,DIRECT-TAIWAN SOUTH ,Manufacturing of packing materials,  ,Operation stopped
10019472,20049203,HNMLQMKASH,"IPAX VIETNAM CO.,LTD","KASHIYAMA VIETNAM CO., LTD, Lot 44D, Quang Minh IZ, Chi Dong Town, Me Linh, Ha Noi",VH,JPN,E,IF,12/07/2021,09/03/2021,08/03/2022,ISR - INDUSTRIAL ALL RISKS,1,ARB - PROPERTY ALL RISKS,38999678803,38999678803,,,,,,,,,,18.1AB,DIRECT HANOI,Production of Paper mount,  ,
10004660,20015188,BGBGSKNHB5,"VIETNAM ABRASIVES CO.,LTD","VIETNAM ABRASIVES PRIVATE CO.,LTD, B5-B6 Lot, Song Khe Noi Hoang IZ, Bac Giang City, Bac Giang",VH,IND,C,IF,12/03/2021,11/03/2021,10/03/2022,ISR - INDUSTRIAL ALL RISKS,1,ARB - PROPERTY ALL RISKS,1.04E+11,104000000000,20170213,,,,20170213,,,,,18.2A,DIRECT HANOI,Manufacture of Silicon Carbide,  ,
10000969,20005535,DNBHLBMUSA,"VIETNAM MUSASHI PAINT CO.,LTD","VIETNAM MUSASHI PAINT CO.,LTD, Plot 227/1 Amata IP,Long Binh ward,Bien Hoa city, Dong Nai",VC,JPN,E,IF,15/03/2021,15/03/2021,14/03/2022,ISR - INDUSTRIAL ALL RISKS,1,ARB - PROPERTY ALL RISKS,99385851304,99385851304,20180110,,,20180110,,,20150507,,,18.1AB,DIRECT HCM,Mixing paint manufacture,  ,
10006937,20020304,HNDTDV1BHI,"HIROSHIMA ENERGY SUPPLY CO., LTD","HIROSHIMA ENERGY SUPPLY CO., LTD., Lot B, Extension Dong Van 1 IP, Duy Tien district, Ha Nam",VH,JPN,E,IF,17/03/2021,16/03/2021,15/03/2022,ISR - INDUSTRIAL ALL RISKS,1,ARB - PROPERTY ALL RISKS,33011806108,33011806108,20191126,,20191126,,20170223,,,,,19.1B,DIRECT HANOI,As above,Production and selling of LP gas and other gases including related equipment ,
10000809,20032136,BDTUTHYEIJ,"YEI JER (VN) INDUSTRIAL CO., LTD","YEI JER (VN) INDUSTRIAL CO., LTD, Khu Pho My Hiep, Thi Tran Thai Hoa, Tan Uyen,, Binh Duong",MS,TWN,E,IF,17/03/2021,16/03/2021,15/03/2022,FEC - FIRE AND EXPL COMP,1,FEC - COMPULSORY FIRE and EXPLOSION,71252328600,71252328600,20191030,,20191030,,20171110,,,,,18.1CB,DIRECT-TAIWAN SOUTH ,As above,"Manufacturing, Processing plastic materials & raw materials for Shoes ",
10000800,20020419,DNNTNTELMA,"ELMA VIET NAM INDUSTRIAL CO.,LTD","ELMA VN Industrial Co., Ltd, Road No. 2, Nhon Trach 1 IZ, Nhon Trach District, Dong Nai",MS,TWN,C,IF,30/08/2021,17/03/2021,16/03/2022,FEC - FIRE AND EXPL COMP,1,FEC - COMPULSORY FIRE and EXPLOSION,2.69E+11,269000000000,20181225,,,20181225,,20160118,,,,18.2A,DIRECT-TAIWAN SOUTH ,Metal Factory,  ,Simple ssurvey by MKT
10001144,20049558,SGBTDBP220,TOYOTA HIROSHIMA TAN CANG-HT,"TOYOTA HIROSHIMA TAN CANG- HT, 220 Bis Dien Bien Phu Street, Ward 22, Binh Thanh, HCMC",VC,JPN,E,IF,25/03/2021,25/03/2021,24/03/2022,ISR - INDUSTRIAL ALL RISKS,1,ARB - PROPERTY ALL RISKS,4.78E+11,478000000000,,,,,,,,,,8.2B,DIRECT HCM,"Show room, selling and repairing vehicle",  ,
10017511,20041281,HNDTDVHNMR,"HANOI MARUITO CO.,LTD","Hanoi Maruito Co., Ltd, Dong Van 2 IZ, Bach Thuong, Duy Tien, Ha Nam",VH,JPN,D,IF,30/03/2021,30/03/2021,29/03/2022,ISR - INDUSTRIAL ALL RISKS,1,ARB - PROPERTY ALL RISKS,30380889339,30380889339,20181116,,,20181116,,,,,,18.1AB,DIRECT HANOI,Sewing thread factory,  ,
10000120,20026002,BDTAVSMTIV,MTI VIETNAM CORPORATION,"MTI VIETNAM CORPORATION, 35 VSIP Road 8, VSIP, Thuan An, Binh Duong",VC,JPN,D,IF,30/03/2021,30/03/2021,29/03/2022,ISR - INDUSTRIAL ALL RISKS,1,ARB - PROPERTY ALL RISKS,36190967186,36190967186,20180309,,,20180309,,,20151109,,,18.1AB,DIRECT HCM,Garment producer,  ,
10009297,20032764,BDTAVS76DL,"NIPPON CHEMIPHAR VIETNAM CO.,LTD","NIPPON CHEMIPHAR VIETNAM CO., LTD, 76 Dai Lo Doc Lap, VSIP, Thuan An, Binh Duong",VC,JPN,C,IF,31/03/2021,31/03/2021,30/03/2022,ARC - PROPERTY ALL RISKS,1,ARB - PROPERTY ALL RISKS,34276743,789000000000,,,,,,,,,,18.2A,AON-BRK-VC,As mentioned above,"Manufacturing pharmaceutical products, providing service of research and development of the pharmaceutical products, Importing and distributing pharmaceutical products, medical",
10002546,20015471,HYVLPNAIDE,"YAMATO RUBBER VIETNAM CO., LTD.","IDE International  Co., Ltd, Plot D-E-F-GH, B2 St, B Sec, Pho Noi A IP, Van Lam, Hung Yen",VH,JPN,D,IF,21/10/2021,31/03/2021,30/03/2022,ISR - INDUSTRIAL ALL RISKS,1,ARB - PROPERTY ALL RISKS,968235,22288769700,20191210,,20191210,,20170314,,,20140519,,18.1AB,DIRECT HANOI,Manufacturing electric components,Manufacturing electric components  ,
